title,company,location,link
Python Developer,YouGov,No office location,https://stackoverflow.com/jobs/330681
Python Software Engineer (40h/wk),Channable,"Utrecht, Netherlands",https://stackoverflow.com/jobs/265091
PAYアプリケーションエンジニア(Python),type転職エージェント,"Shibuya City, Japan",https://stackoverflow.com/jobs/309585
Quantitative Research Engineer (Python),Hudson River Trading,"New York, NY",https://stackoverflow.com/jobs/287292
Pythonエンジニア/出版・新聞・雑誌,株式会社 TORICO,"Chiyoda City, Japan",https://stackoverflow.com/jobs/356470
Mid-Level Backend Software Engineer (Python / Django),Tivix,"Wrocław, Poland",https://stackoverflow.com/jobs/347101
Full-Stack Python Engineer,Gorgias,"Paris, France",https://stackoverflow.com/jobs/333474
Pythonエンジニア(R) / Webマーケティング・ネット広告,株式会社 クレスティア,"Shibuya City, Japan",https://stackoverflow.com/jobs/309503
"Python Developer (m/w/d), Backend, Massendatenverarbeitung",solute GmbH,"Karlsruhe, Deutschland",https://stackoverflow.com/jobs/283754
Boston HealthTech company seeks Senior Python Engineer,Logisticare,"Boston, MA",https://stackoverflow.com/jobs/151907
Backend Software Engineer (Python / Django),Tivix,"London, UK",https://stackoverflow.com/jobs/347102
Python Software Engineer,bloomon,"Amsterdam, Netherlands",https://stackoverflow.com/jobs/286140
Senior Python Back End Engineer,Loadsmart,"Florianópolis, Brazil",https://stackoverflow.com/jobs/390316
Pythonエンジニア,株式会社センティリオンシステム,"Shinagawa City, Japan",https://stackoverflow.com/jobs/340456
Senior Software Engineer (Python/Django),Back Market,"Paris, France",https://stackoverflow.com/jobs/347057
Pythonエンジニア / Webマーケティング・ネット広告,株式会社 クレスティア,"Shibuya City, Japan",https://stackoverflow.com/jobs/369231
Python Developer (Platform team),Preply,"Kyiv, Ukraine",https://stackoverflow.com/jobs/374739
Senior Python Engineer (m/f/d),Bonial International GmbH,"Berlin, Germany",https://stackoverflow.com/jobs/390255
Siri - Software Engineer in ML (C++ & Python),Apple,"Cambridge, UK",https://stackoverflow.com/jobs/380666
"QA Automation Engineer (Python, Browserstack): Remote (Global)",Modus Create,No office location,https://stackoverflow.com/jobs/391485
Python Test and Integration Engineer for Rail Automation - Prague,Siemens AG,"Prague, Czechia",https://stackoverflow.com/jobs/373474
Senior Python Developer (Remote),X-Team,No office location,https://stackoverflow.com/jobs/203899
(Senior) Python Engineer / Architect (m/f/x) for Logistics #StaySafe,"AVANTGARDE - ""Creating Fans""","Berlin, Deutschland",https://stackoverflow.com/jobs/283674
開発×Python,株式会社キャリアデザインITパートナーズ,"Shinagawa City, Japan",https://stackoverflow.com/jobs/378621
Senior Python Backend Engineer - Marketing Tech (f/m/d),Delivery Hero SE,"Berlin, Germany",https://stackoverflow.com/jobs/390276
Senior Python Developer,Anaplan,"Kefar Sava, Israel",https://stackoverflow.com/jobs/353112
AIシステム向けデータサイエンティスト(Python・R言語),株式会社アイソル,"Koto City, Japan",https://stackoverflow.com/jobs/349472
Python Developer suchen Kollegen (m/w/d),solute GmbH,"Karlsruhe, Deutschland",https://stackoverflow.com/jobs/284443
Senior Python Software Engineer - Join our growing team of 30+ developers,Tails.com,"Richmond, UK",https://stackoverflow.com/jobs/254448
Senior Java / Python Developer for international data analysis company,CARFAX Europe GmbH,"München, Germany",https://stackoverflow.com/jobs/255728
"Software Developer (m/w/d) Python, JavaScript, Linux",solute GmbH,"Karlsruhe, Deutschland",https://stackoverflow.com/jobs/283761
Senior Python Software Engineer,YouGov,"Warsaw, Poland",https://stackoverflow.com/jobs/308771
AI関連システムの開発(Python),株式会社キャリアデザインITパートナーズ,"Shibuya City, Japan",https://stackoverflow.com/jobs/375887
派遣/土日休み GW開発 Javascript python Python,株式会社スタッフサービス　エンジニアガイド,"Fukuoka, Japan",https://stackoverflow.com/jobs/351498
Senior Python Engineer - New Verticals (f/m/d),Delivery Hero SE,"Berlin, Germany",https://stackoverflow.com/jobs/384343
"Software Engineer (Ada, Python, Spark, Z)",Altran UK,"Bath, UK",https://stackoverflow.com/jobs/377147
Developer (m/f/d) C++/C#/Python,umlaut,"Braunschweig, Deutschland",https://stackoverflow.com/jobs/369485
Webシステムエンジニア(Java、.Net、Python、PHP)東京23区/システムインテグレータ・ソフトハウス,株式会社 ウィルオブ・ワーク,"Shinjuku City, Japan",https://stackoverflow.com/jobs/388697
WEBプログラマ(PHP/Python/Java)伏見駅5分,株式会社ジャスウィル,"Nagoya, Japan",https://stackoverflow.com/jobs/379486
Senior Python Engineer,Bulb Energy,"London, UK",https://stackoverflow.com/jobs/363476
Lead Developer (m/f/d) Python / Java - hochskalierendes StartUp,auteon GmbH,"München, Deutschland",https://stackoverflow.com/jobs/372555
Pythonエンジニア / システムインテグレータ・ソフトハウス,株式会社 ゼロフィールド,"Minato City, Japan",https://stackoverflow.com/jobs/321979
Senior Data Engineer (Python),Back Market,"Paris, France",https://stackoverflow.com/jobs/283890
Full-Stack Python Engineer,Gorgias,"San Francisco, CA",https://stackoverflow.com/jobs/374584
Medior Python Developer (Web backend),Azerion,"Schiphol-Rijk, Netherlands",https://stackoverflow.com/jobs/381282
"SE・PG(オープン系)/六本木 3,300円Pythonでの自社サービス分析エンジニア",パーソル パナソニック HRパートナーズ株式会社　テクニカル事業本部,"Minato City, Japan",https://stackoverflow.com/jobs/382366
バックエンドエンジニア《Python・PHP 経験者大歓迎》,株式会社エルテス,"Chiyoda City, Japan",https://stackoverflow.com/jobs/346124
Pythonエンジニア / インターネット/Webサービス・ASP,クレジットエンジン 株式会社,"Minato City, Japan",https://stackoverflow.com/jobs/309608
Python/自社プロダクト開発,アララ株式会社,"Minato City, Japan",https://stackoverflow.com/jobs/318510
"DevOps Engineer - Kubernetes, Docker, Go, Node.JS, Python",Beamery,"London, UK",https://stackoverflow.com/jobs/366693
Python Engineer,"TileDB, Inc.","Cambridge, MA",https://stackoverflow.com/jobs/365175
Senior Python Developer,Anaplan,"Kefar Sava, Israel",https://stackoverflow.com/jobs/353112
Full-Stack Python Engineer,Gorgias,"San Francisco, CA",https://stackoverflow.com/jobs/374584
Senior Python Engineer,Altitude Networks,"San Francisco, CA",https://stackoverflow.com/jobs/355790
自社漫画サービスWebエンジニア(Python/PHP)/出版・新聞・雑誌,株式会社 TORICO,"Chiyoda City, Japan",https://stackoverflow.com/jobs/388695
Pythonエンジニア / インターネット/Webサービス・ASP,クレジットエンジン 株式会社,"Minato City, Japan",https://stackoverflow.com/jobs/309608
Senior Full Stack Python Engineer,RippleMatch,"New York, NY",https://stackoverflow.com/jobs/348517
Perl、PHP、Python、SQLを扱う汎用系SE(40代50代活躍),コスモテクノス株式会社,"Shinjuku City, Japan",https://stackoverflow.com/jobs/369832
Pythonエンジニア【ビザスク開発グループ】 / インターネット/Webサービス・ASP,株式会社 ビザスク,"Meguro City, Japan",https://stackoverflow.com/jobs/366996
Opening for Python Developer - CMML5 company - Bangalore Location,Team Ware Solutions,"Bengaluru, India",https://stackoverflow.com/jobs/380373
Python & .Net Developer,Mantu,"Bengaluru, India",https://stackoverflow.com/jobs/380341
Python Backend Developer (m/f/d) - Industrial Data Science and Software,Smart Steel Technologies GmbH,"Berlin, Germany",https://stackoverflow.com/jobs/334428
pythonエンジニア,トライアロー株式会社,"Sapporo, Japan",https://stackoverflow.com/jobs/369819
Sr. ETL Database Engineer -  Python [100% REMOTE],Clevertech,No office location,https://stackoverflow.com/jobs/389854
Senior Software Engineer with Python experience - Activation,Epidemic Sound AB,"Stockholm, Sweden",https://stackoverflow.com/jobs/389861
Reporting Engineer (Deep proficiency with SQL and Python),British Columbia Investment Management Corporation (BCI),"Vancouver, BC, Canada",https://stackoverflow.com/jobs/390631
Pythonエンジニア,株式会社ダイヤモンドファンタジー,"Chuo City, Japan",https://stackoverflow.com/jobs/309531
Developer (Python OR JavaScript),Odoo,"Ramillies, Belgium",https://stackoverflow.com/jobs/167359
"Data Engineer (Java, Python, AWS)",Ascend Group,"Khwaeng Bang Chak, Thailand",https://stackoverflow.com/jobs/340997
"時給3,100円 即日/Python/営業支援システム開発",株式会社エーティーエス,"Minato City, Japan",https://stackoverflow.com/jobs/387257
Senior Full Stack Software Engineer (React Python Flask),FineTune Learning,No office location,https://stackoverflow.com/jobs/270372
Python/Ruby/Perl/PHPエンジニア,株式会社ビットストロング,"Minato City, Japan",https://stackoverflow.com/jobs/318061
自社提供サービスに関連したシステム開発業務(Python),株式会社パソナテック,"千代田区, Japan",https://stackoverflow.com/jobs/310808
"Software Engineer I (Java, .Net, Python, JSON, XML, Git, TFS, SVN)",British Columbia Investment Management Corporation (BCI),"Vancouver, BC, Canada",https://stackoverflow.com/jobs/355067
Python Developer,Rocket Lab,"Auckland, New Zealand",https://stackoverflow.com/jobs/276434
"Python Developer (Onsite in Paris, or Remote in France, UK, Germany)",PeopleDoc,No office location,https://stackoverflow.com/jobs/374071
Pythonエンジニア(東京中心+リモートワーク可) / インターネット/Webサービス・ASP,株式会社 Stroly,"Chiyoda City, Japan",https://stackoverflow.com/jobs/345677
Python Engineer,"TileDB, Inc.","Cambridge, MA",https://stackoverflow.com/jobs/365175
Python Developer,Rocket Lab,"Auckland, New Zealand",https://stackoverflow.com/jobs/276434
Python Developer,Zaaksysteem.nl,"Amsterdam, Netherlands",https://stackoverflow.com/jobs/333770
"【横浜・他言語からのスキルチェンジOK!】Python, PHP, Goエンジニア",株式会社ベイストリーム,"Yokohama, Japan",https://stackoverflow.com/jobs/381187
Perl、PHP、Python、SQLを扱う金融系SE(残業少な目、プライベート充実),コスモテクノス株式会社,"Shinjuku City, Japan",https://stackoverflow.com/jobs/369834
Python Engineer (m/f/d),e-bot7 GmbH,"München, Germany",https://stackoverflow.com/jobs/375389
システムエンジニア(Java、.Net、Python、PHP) 東京都江東区 東証一部上場グループ,株式会社ウィルオブ・ワーク システムインテグレーション事業部,"Chuo City, Japan",https://stackoverflow.com/jobs/359955
Software Engineers - Cloud Reliability & Infrastructure (Python or Java),Canva,"Sydney, Australia",https://stackoverflow.com/jobs/373689
Pythonでの通信キャリア向け業務効率化ツール開発,株式会社ブレーンネット,"Koto City, Japan",https://stackoverflow.com/jobs/355377
Senior Python Engineer - Global Contact Center Tech (f/m/d),Delivery Hero SE,"Berlin, Germany",https://stackoverflow.com/jobs/388542
"Freelance Python Developer – Remote, Full-time",Toptal,No office location,https://stackoverflow.com/jobs/382544
Pythonエンジニア,株式会社ビットストロング,"Minato City, Japan",https://stackoverflow.com/jobs/365868
Pythonエンジニア,株式会社エム・フィールド,"Shinagawa City, Japan",https://stackoverflow.com/jobs/358157
"Technical (Solutions) Architect - Java/Python/JS, AWS Serverless",Liberty IT,"Dublin, Ireland",https://stackoverflow.com/jobs/390886
即日/交通費支給/Python/ツール開発支援業務,株式会社エーティーエス,"Suginami City, Japan",https://stackoverflow.com/jobs/386243
Python Data Analytics Analyst,Barbaricum,"Tampa, FL",https://stackoverflow.com/jobs/388648
Senior Full Stack Engineer (Python),株式会社カウリス,"Chiyoda City, Japan",https://stackoverflow.com/jobs/310076
SE・PG(オープン系)/大崎 Python機械学習アルゴリズムの実装(2800~),パーソル パナソニック HRパートナーズ株式会社　テクニカル事業本部,"Shinagawa City, Japan",https://stackoverflow.com/jobs/382359
Python、Perl/通信キャリア向けオペレーション自動化PG作成,株式会社ブレーンネット,"Saitama, Japan",https://stackoverflow.com/jobs/379707
派遣/未経験OK プログラミング業務 天王洲アイル駅近 Python,株式会社スタッフサービス　エンジニアガイド,"Shinagawa City, Japan",https://stackoverflow.com/jobs/343838
データエンジニア(Python Java),株式会社キャリアデザインITパートナーズ,"Chuo City, Japan",https://stackoverflow.com/jobs/365312
"Mid Level API Developer who loves Python, AWS and REST",EDF,"Crawley, UK",https://stackoverflow.com/jobs/371105
Pythonエンジニア / インターネット/Webサービス・ASP,株式会社 ZEALS,"Shinagawa City, Japan",https://stackoverflow.com/jobs/331606
